review,user,score,review_date,loc,helpful
"I had an 8 .9 (which was a wonderful tablet for its day).  Then I got a 7"" for my Mom.  Not so great, too small.  I ordered an 8"" (OK, but nothing special) , and then a 7th gen 10"", which is nice.  My Mom is getting frustrated with the lack of newer games for her old 7"" , so I am giving her the newer 8"" so she can load more card games.I play a lot of role-playing games and also read a lot, so 10"" tablets are a must for me.  This 9th Gen is quite similar to my 7th Gen.  It virtually set up itself based on my previous settings on my older tablet.  (UPDATE 10/31:  Although the Silk browser bookmarks and favorites did sync, books and apps did not sync.  I'm hoping that this issue will be corrected by Amazon soon.)  (UPDATE 11/2:  A hard shutdown and reboot has resolved the above issues).  The drop down options are slightly different.  If you have a 7"" or an 8"" Kindle, you will probably be impressed with this tablet's capabilities.  If, like myself, you have an older 10,  the differences won't be immediately apparent.  I'm assuming that the promised increased speeds will be noticeable when I get a chance to stream video or play my games.Those of us who utilize Amazon products and services enjoy our Fire tablets.  Those who don't would probably prefer other brands of tablets, because Amazon doesn't make it easy to access content that isn't Amazon.",Jcat,4.0,"October 30, 2019",United States,"1,006"
"I l logged in to increase my rating but my review was not there.  In my review of yesterday (which is gone), I complained that Location Services would not kick in and Tech Support could not assist.  I primarily wanted the tablet to stream TV -- in my case Hulu.  Hulu would not stream due to lack of location and weather had me in Seattle when I am in Alabama.  I gave a One Star review and was deliberating what to do -- perhaps send back.  This post is for (hopefully) the assistance of others.  I took my tablet to my gym (which has guest WiFi) and logged in to WiFi there.  Location Services kicked in.  Hulu worked.  I returned home and it now works on my home network.  Not a very high tech or explainable solution -- but a resolution.  Hint to Tech Support:  Recommend this to callers if your hour+ of support does not produce results.",Ken Loeb,3.0,"October 31, 2019",United States,955
"Do not buy this!!! 5 of them in 18 months, each one progressively worse. Newest one arrived 10/30. Downloaded my library 4 times in 8 days. The books just vanish off the tablet. Product support useless. Can’t solve the problem can’t understand them. Not an item to be outsourced. I’ve had fire tablets since they first came out, this model s horrible. First one lasted 7 months, next one 5 months, next one 3 months (they sent refurbished without telling me that and it had no warranty), then the next lasted 2 months. Waited 3 weeks for the newest one, it’s lasted 8 DAYS!!!!",Keri,1.0,"November 7, 2019",United States,527
"Update:  keep encountering other buyers realizing too late to return that the device isn't a standard android tablet.  Service is so nonexistent that they're seeking help online on message boards.  Save yourself.cannot access owned apps through playstore. Non-US customer service just says sorry, no help. The device link to get service is stuck in an endless loop redemanding entry of a phone number.They did something to make the google play store not install, even though it would on prior models.Massive bezel, and this thing weighs a relative ton.Amazon should have just ordered some Samsung tablets and loaded them with their bloatware, which they also blocked prior methods of removal.Just trying to watch youtube is a nightmare, it resizes and behaves oddly unlike any other tablet on the planet. Don't know what they did, but apparently they hate google enough to make us hate Amazon with this tablet.Returned within 24 hours after fruitless chats with supposed service.I traded in my old fire tablet and used the proceeds to buy this piece of crap, which is not just money lost since Amazon doesn't provide service on trade in money if you return the device, again according to their lousy non-US customer ""assistants"". Save yourself the headache and buy something better.",mixed.blessings.choose.wisely,1.0,"October 31, 2019",United States,377
"Your browser does not support HTML5 video.


   What is this flickering on the tablet? See video and picture. Usually happens when I connect and app to Facebook. Great tablet, I love it otherwise, but not sure what’s going on with this flickeringUPDATE#1-Amazon tech support Rachel, called me after seeing my review and tried to help me. She took control of my tablet to view the problem and did trouble shooting. Amazon is going to send me a new tablet as I am the only one with this issue. I really enjoy the new fire 10! It’s faster than the 7th gen, and worth every penny! Thanks Amazon!UPDATE 2: David R from device retrieval is terrible and does not care for Amazon customers. He sent me a label to return the defective device and stated I would get a $30 credit by returning it in 48 hours which I did. But his label was missing when I tried to print so I called Amazon and was told by Lucien B. That David made a mistake and did not send me a proper label and Lucien B from amazon sent me another. I returned the device and because David’s label was not working I will not get a credit as promised. David R would not let me speak to a manager he stated he was in the highest position at Amazon and there was no one higher than him I could speak to. Plus the replacement tablet is also flickering when you connect games to Facebook!FINAL UPDATE: Rachel from tech support has taken care of all the above and sent reassuring communication to me. She has gone above and beyond to take care of my issues and keep an Amazon customer satisfied and happy. She really cares about Amazon customers! Don’t lose this employee Amazon or it would be your loss! Thanks Rachel! Regarding the tablet, the battery lasts super long, I can go 2 days without charging it! Very responsive and I love it more than any of the other fires I own-7 inch, 8 inch, and previous version 10 inch.",Brenda A,5.0,"November 1, 2019",United States,343
"2 things.First pay the extra money so as not to be bombarded by ads every time you turn it on, switch app or it goes to sleep.Second, it says you can use an SD card for your own files.  however, its not easy and the normal apps don't work with anything that's not PURCHASED via AMAZON!In my opinion, this device has become an extension of Amazon's marketing department and no longer serves as a pleasure device for customers.This is one of those things you leaving you to wonder what happened to customer service in the retail industry",WoodstockDan,1.0,"November 19, 2019",United States,349
"update 11/5/2019 9:33pm eastern3 separate support sessions, the most recent decided I needed an RMA. it arrived today and I decided to give it a shot, to continue with the support process.  loaded everything up, set it to charge and headed out for a little while.  upon my return, everything was wiped as before.  not surprised, something's up with the software on these things.  i did try the delete app cache/etc for kindle app itself on the fire, but that did not work either.  i havent heard back from the escalated person I was working with in a few days, but they definitely have some reading material from me when they are able to get to it.  stay tuned!original review text:after multiple support requests, amazon wants to ""replace under warranty."" there's nothing physically wrong with this device, it will just delete all of your downloaded content while charging.  its pretty much garbage software, the hardware is great though.  really frustrating.",Robert,1.0,"November 3, 2019",United States,271
"Wow, with the sub-par reviews from the tablet snobs and geeks. This was 150 bucks! I bought three Fire HD8 tablets two years ago for me, my wife and daughter. Used almost daily and still like new. Replaced a Samsung 8 tablet that I was never really happy with. Love this upgrade. What a great size for watching videos, and the sound is pretty decent. A cheap pair of plug-in or bluetooth speakers will make it even better. Even better with headphones. Had a couple of friends with Apple tablets get these after they saw mine. I can shove mine in a backpack and tote it around carefree while they have to worry about damaging an expensive piece of gear. Now they are enjoying the Fire and don't miss the IPad. I can't speak for anyone doing anything other than watching videos, playing light games and surfing the internet. Oh, and reading! I love reading books and comics on this thing - even better with the bigger screen! Anyways, I digress, if you're into the things I mentioned then don't hesitate to buy this. At this price-point it is an awesome entertainment gadget, and I would never try to do spreadsheets or Power Point presentations for a million dollar deal (although it might do that?). Someone else mentioned that it doesn't do well with a Malware program. This is my third tablet and I have never had a problem with malware. Not sure why, but just throwing that out there. Never used anti-malware. I love these tablets and am really excited after putting this one through the paces!I have to add - buying the Amazon case for this is a must! Honest to God, I don't work for Amazon, but the cases that go with these are the absolute best and look and feel like they were built together. I admit the case is a little pricey but worth every penny. I bought an aftermarket case for the aforementioned Samsung tablet and hated it. It just felt ""wonky"", like a cheap glove.",bhinch,5.0,"October 31, 2019",United States,201
"All downloaded content disappears overnight.  The speed of download is fast, the display is lovely, it feels light enough for the size, and what an amazing value for the money.  But useless unless you have wi-fi since all content you download disappears immediately",Kindle Customer,1.0,"November 6, 2019",United States,222
"Fantastic product! My kids have a few fire 7's to beat around with, but wanted something a bit faster mainly for streaming and browsing.Extremely quick between apps, videos play without any issue, screen looks beautiful compared to past iterations.  Most bad reviews so far have been people trying to use incompatible accessories from past fire hd tablets that used micro USB.Fast charging time with 15w adapters and the type C port is a welcome upgrade.  Obviously if your not a fan of the amazon ecosystem or OS, then you might want to go with something that runs stock Android or iOS.  For the price and these specs, this tablet really can't be beat.",Bryan,5.0,"October 31, 2019",United States,202
"Very disappointed. First - The Silk browser which apparently is the only one I can use accepts, without question nor warning, revoked SSL/TLS certificates. Anyone who uses it is setting themselves up for some potential serious malware attacks. Second - My old Kindle Fire HD 8.9 had a mini HDMI port that allowed me to connect the device to a big screen TV which I used off grid to watch Prime content by downloading Prime shows/movies to the device then bring it with me when I went off grid. The ""All New FireHD 10 Tablet"" has no such port and hence no such capability. It doesn't support Screen Mirroring either so recasting to a larger device is a desirable feature that was deprecated. Had I known that Amazon was taking these desirable capabilities off the table I would never have purchased this new device to replace my current one.I will say that it is much faster than my old Kindle Fire and that the screen is much nicer but the eliminated features render it virtually useless to me!I tried to add an image of the GRC Certificate Revocation output by using the Silk Browser to access Revoked dot GRC dot Com and using the screen capture on the kindle device to capture the revocation notice. I was able to do that successfully and capture the screen but when I attached the Kindle to my computer to the grab the image and attach it to this review I was informed that my Kindle had ZERO directories or files on it. Another serious problem with this device discovered while trying to document 2 other game changing problems.Now, the best for last. The Kindle Fire HD 10 9th Generation cannot and will not connect to my Fire TV Recast.  The Recast is wired Ethernet connected to a gigabit router with cat6 UTP throughout the house (including connections to my many other Fire Sticks.) Everything communicates just fine except the HD10 - and that includes my Samsung Galaxy S8+. This new tablet insists I need to plug an Ethernet cable into the recast in order to make the connection. That connection is already in place and every other device on the network knows it - except for the New and Improved Kindle Fire HD10 9th generation!  Going into settings in any of my fire TV devices to Live TV/Recast shows a wired connection  with an internal IP address (192.168.1.xxx), and a wired and a wireless MAC address for the Recast Device.I tried everything under the sun to get this to work but to no avail. It just wasn't going to happen. I removed the FireTV app from the HD10,  shut everything down, removed the Ethernet cable from the Recast, started the devices up again, downloaded and installed the Recast APP on the Kindle, started the pairing process, got to the screen where it says ""Your Fire TV Recast needs an Ethernet Cable plugged into it...."".  So I plugged it back in and nothing happened. I was given no option to move ahead. All I could do was back up a screen and go into an endless loop of going nowhere!In desparation I did a factory reset on the HD10 and went through the pain of setting it up and re-authenticating with my highly entropic 63 character bullet proof passwords only to end up back in the same place... NOWHERE!Can you spell ""BUYER'S REMORSE"" and ""UTTER FRUSTRATION""? After reading this I am guessing that you probably can.This most recent discovery has prompted me to downgrade my 2 stars to 1 star.",Justin Sayne,1.0,"November 24, 2019",United States,177
Beautiful tablet. White as snow! Setup was a breeze. Pre-ordered on impulse when I found it would be releasing in this color. I love it!,Amazon Customer,5.0,"October 30, 2019",United States,162
"Amazon is really going down. I've had lots of battery trouble with all my kindkes. It's the battery that kills them. And while I was able to replace the battery on my first kindle, they made it harder, then impossible. But I got this new kindle so I would be able to restore my bookmarks. The main reason I hate the Silk browser is not being able to import or export bookmarks. I think it's deliberate. But I bought this new 10 inch just to keep my bookmarks. But while it would restore my ebooks, it wouldn't restore my bookmarks, which is a deal breaker for me.Got on the phone trying to get help and talked to someone who barely spoke Engish, who wanted to wipe my old 8.9, the kindle I loved best, instead of this 10 inch. And when I said bookmarks this guy thought I meant ebooks, which did restore. Took a while to half show him what I was talking about. No matter how long I was on, following his directions, no bookmarks.Now I have to send this back, get another kind of tablet and lose all my bookmarks. Really upset about it. But nothing I can do.",alllie,1.0,"November 2, 2019",United States,167
Have not set it up. I had bought the charging dock for this new tablet. Guess WHAT it does not CONNECT TO THE CHARGING DOCK.,Bobo,1.0,"October 30, 2019",United States,153
Purchased new Kindle Fire because update on phone no longer allowed me to connect to my hotspot and figured that it was time to update since I had my kindle fire for a few years. I liked the text to speech feature on my table which allows me to listen to my books while I am working. On the new kindle the text to speech reads a page when the cover is closed and then stops. When the cover is open the text to speech may last at the max 20minutes before it stops. Sometimes it will start again once the screen is unlocked. If you value this feature this is extremely annoying. And there is nothing listed on the help manual to fix this problem.  I have not tried the other features on the tablet yet only had it for a couple of days but the main feature that I wanted which is text to speech is the feature I am having the most issues with. I called tech support and was offered $5 for my inconvenience and told that the problem is a known issue and will be fixed in two days. What a crock ... none of it was true..thinking about returning tablet for a refund.,E.D,1.0,"November 13, 2019",United States,128
"I will keep it short and simple. Picture and sound are great. does seem faster at times but at others times will be ""laggy"" for no reason when I am not downloading or streaming things. Last the big issue I have is that it keeps.deleting my ebooks, I have had a kindle some the first gen kindle fire and have a nice ebook collection and  it matter how I try it seems to delete and.I download every 8 to 10 hours and so far no real answers from tech support.UPDATE: Okay so a day after this review was posted I was contacted by an Amazon tech person. This time after explaining what was going on and what had already been tried I was sent a new kindle along with instructions on how to return the one I had. The new one came and the old one picked up 3 days later. I downloaded a book and it was still there for 2 days but on the third day it had been deleted, however the kindle had also received an update. Later the same day the same tech person called me and asked about things to which I explained okay till that morning when again books where deleted from the unit. I was told that the update was to fix this issue. (Guess I was not the only one) I am very happy to say that since thank have downloaded my library of over 600 books and no issues with them be deleted now after a week. I also want to add that the issue with the random ""lag"" I had had also stopped.",craig blanton,4.0,"November 2, 2019",United States,123
"I'm not the typical user of a tablet; not a gamer, do all my computing at home on a desktop, don't do social media, don't even have a smartphone.  I've worn out one Kindle E-reader and am hard at work on the second.  I would quite probably have let the tablet scene pass me by, except that I acquired (in 2013) one of the early Fire tablets (HD7) as a premium gift for buying a treadmill from Yowza Fitness.  In a word, I loved it; book and magazine illustrations in Hi-def color was one of its most enjoyable features to me at the time.  It was a little underpowered for video, though it would stream non-HD content fair-to-middling and play just about any downloaded video just fine, HD or not.  So I used and enjoyed it for six years, until I caught wind of the soon-to-be-released Amazon Fire Tablet HD10; there was a lot being said about it, most of it quite positive, enough so that I took the plunge and invested a little less than 250 dollars (tablet, case and heavily-discounted SD memory card).  I can't speak for others, only for myself, but I think I got a heck of a good deal.  The tablet is beautifully made and has a good solid heft; the case is a perfect match for it.  The designers and manufacturer couldn't have improved on it; for looks, I think they came up with a winner.  The colors, graphics, video definition (it also streams HD just fine!) are all top of the line.  It's a bit more complicated than the other one, but still easily learned.  It comes with a fairly large number of Apps preinstalled, and that aren't designed to be removed; I don't mind that too much since there's only a very few that I wouldn't use at all, and I've got LOTS of storage space.  But it is kind of annoying that I can't ""hide"" the icons that fill up the Home screen like I can do on my old desk-top Acer running Win 10.  And while I have nothing against it, I also have no real use for or interest in the Alexa feature; its home-screen icon is four times the size of all the others, and constantly exhorts me to tell Alexa to do something.  But those are minor details and take nothing at all away from my overall positive view of this exceptionally fine example of precision electronics.  And the price! A genuine bargain.  Thanks very much for a fine product and letting me say a few words about it.UPDATE TO ORIGINAL REVIEW January 26, 2021:  I've had this tablet for just over 14 months, and have used & enjoyed it just about every day of those 14 months.  I successfully installed Google Play Store shortly after I bought the tablet, specifically to get Google Chrome which greatly enhanced its value & utility.  I was able to watch HD videos on YouTube, TV shows & movies on Amazon Prime, all without any buffering.  I regularly read books & magazines in stunning color on the nice large 10-inch screen using the Libby App.  In short, I was very happy indeed with my tablet.  Which is why I was both surprised and disappointed when it suddenly and inexplicably stopped working.  I'd been reading a library book off and on the past few days (I've read dozens on the tablet) and today I stopped reading to have supper; just closed the case like I've done from the beginning as it just puts the tablet to sleep.  When I'm ready to use it again I just open the case and the advert screen comes on first; I just swipe upwards and get back to the exact page of my book that I was reading, or the home screen if I closed the app before putting the tablet to sleep.  After supper today, when I opened the case, I was met with a blank screen, like I'd completely powered down (I hadn't).  Pressing the on/off switch did nothing; pressing and holding for a slow count of 10 was the same.  Plugging it in to the AC Charger should have within a few seconds rebooted the tablet; several times I've read or watched videos to the point where I ran out of juice and the tablet says ""powering down"" and turns itself off, but plugging it into the AC turns it right back on again, showing the charging symbol doing it job.  The tablet was not low on battery power this time; when I closed the case to go eat supper the battery icon in the upper right corner read 48%; it should not have turned completely off, it should have just gone to sleep like it always has.  Even after leaving it on the AC Charger for >2 hours, pressing the on/off switch did nothing; the tablet is completely dead, and I cannot figure out why; it was working flawlessly.  What I said in my original view about its being an ""exceptionally fine example of precision electronics"" still holds.  This is a great tablet; I just had bad luck with mine.",xgi93,5.0,"November 4, 2019",United States,95
"I thought this was going to be a great tablet until I got it and realized it had two capabilities missing. It has no screen mirror capability even to their own Fire TV stick! There are standards here, it should work with Roku and Chromecast and other TV streaming devices. Then I moved to ""well I will have to go to the wired mode"". But no, the new USB-C connector is used for charging and DOES NOT SUPPORT USB-C TO HDMI TO GET TO YOUR TV. With these 2 capabilities missing the tablet is so crippled it will have to sell for a much lower price.Given this I encourage Amazon to bring back screen mirroring and to bring industry standard capability to the ""USB-C"" connector or label it a charging port and not USB-C. Without these changes I give the tablet a 1 star rating.",Kent H.,1.0,"November 26, 2019",United States,106
"I own previous generation of Fire HD 8 and Fire HD 10.  So, I know how the Fire tablet works with micro sd card.However, this is Fire HD 10 tablet, working with micro sd card is a challenge.  After spending some time and some tests, I have some findings.  This Fire HD 10 tablet requires you to erase (format) your inserted micro sd card before the first use in the tablet.  And the format is only FAT32.  (FAT32 is a problem for some large size Sandisk micro sd card with the File  Reading Error.  I was told that ExFat format is safe for large size micro sd card)Regardless, you can't come prepare with files on your inserted micro sd card.  You have to let this Fire tablet to erase (format) for you.  Once you do that, it gives you two options.  1.  Use the micro sd card as the internal storage of the fire tablet, i.e. apps  2.  Use the micro sd card as portable storage only, i.e. music files or data files)So, you don't have to flexibility to switch sd cards.I tested a 32G, 64G and 128G micro sd card.  I am comfortable to use 128G now.The speed is very good on this device, compare to my other collections of previous generations of Fire tablets.About battery life, I am going to find out.",T. Yiu,4.0,"November 23, 2019",United States,88
"I have had this 2 days.. I have had to download the same books on the 'integrated' Kindle app 4 times since it seems to think I want to remove them every time I switch to a different app.  When switching out of the Book app, it doesn't save the book I am reading (it does save the location on the book I am reading) and I have to re-open it every time.  Kindle app on iPad and phones works much better.I will be returning the device and not asking for a replacement.",Mike M,1.0,"November 5, 2019",United States,100
I have had my Fire HD for two days and it seems ok. The reason I’m giving 2 stars is because I paid and extra $15 for no ads and I started receiving them anyway. I ended up spending time figuring out how to turn them off.I am debating sending my tablet back some the $15 extra for no ads was a farce and I would consider it false advertising.,Dean S,2.0,"November 17, 2019",United States,81
